[
  {
    "date": "2026-07-10",
    "readingSessions": 1,
    "distinctPapersTouched": 1,
    "readingMinutes": 20,
    "activeDay": true,
    "completedPasses": 1,
    "revisits": 0,
    "implementations": 0,
    "deepSessions": 0,
    "paperIds": [
      "paper-one"
    ]
  },
  {
    "date": "2026-07-11",
    "readingSessions": 1,
    "distinctPapersTouched": 1,
    "readingMinutes": 45,
    "activeDay": true,
    "completedPasses": 1,
    "revisits": 0,
    "implementations": 0,
    "deepSessions": 1,
    "paperIds": [
      "paper-one"
    ]
  }
]
